{
  "book_id": "bright_hearts_fall_01",
  "working_title": "Bright Hearts: Shine Your Light This Fall",
  "subtitle": "A Christian Fall Activity Book for Kids Ages 5-8 \u2014 Bible Mazes, Search & Find, Coloring, Puzzles, Gratitude & Harvest Fun",
  "audience": "Ages 5-8",
  "phase": "B",
  "target_page_count": 48,
  "trim_inches": [
    8.5,
    11.0
  ],
  "dpi": 300,
  "interior": "black_and_white",
  "bleed": false,
  "safe_margin_inches": 0.5,
  "inner_safety_inches": 0.625,
  "outer_safety_inches": 0.5,
  "min_instruction_pt": 12.0,
  "min_puzzle_letter_pt": 12.0,
  "min_answer_key_pt": 9.0,
  "kdp_list_price_usd": 9.99,
  "cover_status": "deferred_until_interior_lock",
  "paid_image_calls_authorized": 0,
  "mission_ids": [
    "mission_01",
    "mission_02",
    "mission_03",
    "mission_04",
    "mission_05",
    "mission_06",
    "mission_07",
    "mission_08"
  ],
  "canon_ids": [
    "matthew_5_16",
    "genesis_1_14",
    "psalm_107_1",
    "isaiah_41_10",
    "hebrews_13_16",
    "ephesians_4_32",
    "genesis_1_31",
    "1_thessalonians_5_18"
  ],
  "sections": [
    {
      "name": "front_matter",
      "first_page": 1,
      "last_page": 4
    },
    {
      "name": "missions",
      "first_page": 5,
      "last_page": 36
    },
    {
      "name": "back_matter",
      "first_page": 37,
      "last_page": 48
    }
  ],
  "pages": [
    {
      "page": 1,
      "section": "front_matter",
      "type": "title",
      "title": "Bright Hearts: Shine Your Light This Fall",
      "mission_id": null,
      "mission_sequence": null,
      "mission_slot": null,
      "canon_id": null,
      "activity_mechanic": "title_ownership",
      "art_roles": [
        "title_lockup"
      ],
      "artwork_status": "placeholder_only",
      "answer_key_page": null,
      "answers_activity_pages": [],
      "answer_sources": [],
      "source_mission_page": null,
      "child_instruction_required": false,
      "notes": "Title and ownership page. Code renders all final type. No baked title lettering in artwork. Marked NON-PRODUCTION placeholder art in Phase B.",
      "facing": "recto",
      "parity": "odd"
    },
    {
      "page": 2,
      "section": "front_matter",
      "type": "welcome",
      "title": "Welcome, Bright Hearts",
      "mission_id": null,
      "mission_sequence": null,
      "mission_slot": null,
      "canon_id": null,
      "activity_mechanic": "how_to_use",
      "art_roles": [
        "welcome_spot"
      ],
      "artwork_status": "placeholder_only",
      "answer_key_page": null,
      "answers_activity_pages": [],
      "answer_sources": [],
      "source_mission_page": null,
      "child_instruction_required": true,
      "notes": "How to use the book for ages 5-8. Child-facing instructions at >=12 pt. Marked NON-PRODUCTION placeholder art in Phase B.",
      "facing": "verso",
      "parity": "even"
    },
    {
      "page": 3,
      "section": "front_matter",
      "type": "contents",
      "title": "Fall Faith Missions Map",
      "mission_id": null,
      "mission_sequence": null,
      "mission_slot": null,
      "canon_id": null,
      "activity_mechanic": "missions_map_contents",
      "art_roles": [
        "missions_map"
      ],
      "artwork_status": "placeholder_only",
      "answer_key_page": null,
      "answers_activity_pages": [],
      "answer_sources": [],
      "source_mission_page": null,
      "child_instruction_required": true,
      "notes": "Eight unique missions, not a duplicated contents list. Map must name each locked verse. Marked NON-PRODUCTION placeholder art in Phase B.",
      "facing": "recto",
      "parity": "odd"
    },
    {
      "page": 4,
      "section": "front_matter",
      "type": "parent_note",
      "title": "A Note for Parents and Caregivers",
      "mission_id": null,
      "mission_sequence": null,
      "mission_slot": null,
      "canon_id": null,
      "activity_mechanic": "parent_bible_source_note",
      "art_roles": [
        "parent_letter"
      ],
      "artwork_status": "placeholder_only",
      "answer_key_page": null,
      "answers_activity_pages": [],
      "answer_sources": [],
      "source_mission_page": null,
      "child_instruction_required": false,
      "notes": "Parent/caregiver note plus Bible-source note: KJV 1769 public-domain short quotations; child paraphrase is never mixed into source_text. Marked NON-PRODUCTION placeholder art in Phase B.",
      "facing": "verso",
      "parity": "even"
    },
    {
      "page": 5,
      "section": "missions",
      "type": "coloring",
      "title": "Shine Your Light",
      "mission_id": "mission_01",
      "mission_sequence": 1,
      "mission_slot": "A",
      "canon_id": "matthew_5_16",
      "activity_mechanic": "integrated_coloring_festival_lanterns",
      "art_roles": [
        "coloring_hero"
      ],
      "artwork_status": "placeholder_only",
      "answer_key_page": null,
      "answers_activity_pages": [],
      "answer_sources": [],
      "source_mission_page": 1,
      "child_instruction_required": true,
      "notes": "Mission 1 slot A. Final page text is rendered by code. Artwork is a marked NON-PRODUCTION placeholder in Phase B.",
      "facing": "recto",
      "parity": "odd"
    },
    {
      "page": 6,
      "section": "missions",
      "type": "search_find",
      "title": "Find the Festival Gifts",
      "mission_id": "mission_01",
      "mission_sequence": 1,
      "mission_slot": "B",
      "canon_id": "matthew_5_16",
      "activity_mechanic": "search_find_festival_gifts",
      "art_roles": [
        "search_background",
        "search_target"
      ],
      "artwork_status": "placeholder_only",
      "answer_key_page": 37,
      "answers_activity_pages": [],
      "answer_sources": [],
      "source_mission_page": 2,
      "child_instruction_required": true,
      "notes": "Mission 1 slot B. Final page text is rendered by code. Artwork is a marked NON-PRODUCTION placeholder in Phase B.",
      "facing": "verso",
      "parity": "even"
    },
    {
      "page": 7,
      "section": "missions",
      "type": "maze",
      "title": "Bring Your Lantern",
      "mission_id": "mission_01",
      "mission_sequence": 1,
      "mission_slot": "C",
      "canon_id": "matthew_5_16",
      "activity_mechanic": "maze_lantern_to_welcome_table",
      "art_roles": [
        "maze_scene"
      ],
      "artwork_status": "placeholder_only",
      "answer_key_page": 37,
      "answers_activity_pages": [],
      "answer_sources": [],
      "source_mission_page": 3,
      "child_instruction_required": true,
      "notes": "Mission 1 slot C. Final page text is rendered by code. Artwork is a marked NON-PRODUCTION placeholder in Phase B.",
      "facing": "recto",
      "parity": "odd"
    },
    {
      "page": 8,
      "section": "missions",
      "type": "faith_interaction",
      "title": "How Can You Shine This Week?",
      "mission_id": "mission_01",
      "mission_sequence": 1,
      "mission_slot": "D",
      "canon_id": "matthew_5_16",
      "activity_mechanic": "faith_lantern_good_works",
      "art_roles": [
        "faith_frame"
      ],
      "artwork_status": "placeholder_only",
      "answer_key_page": null,
      "answers_activity_pages": [],
      "answer_sources": [],
      "source_mission_page": 4,
      "child_instruction_required": true,
      "notes": "Mission 1 slot D. Final page text is rendered by code. Artwork is a marked NON-PRODUCTION placeholder in Phase B.",
      "facing": "verso",
      "parity": "even"
    },
    {
      "page": 9,
      "section": "missions",
      "type": "coloring",
      "title": "Lights for the Seasons",
      "mission_id": "mission_02",
      "mission_sequence": 2,
      "mission_slot": "A",
      "canon_id": "genesis_1_14",
      "activity_mechanic": "integrated_coloring_sky_lights_orchard",
      "art_roles": [
        "coloring_hero"
      ],
      "artwork_status": "placeholder_only",
      "answer_key_page": null,
      "answers_activity_pages": [],
      "answer_sources": [],
      "source_mission_page": 1,
      "child_instruction_required": true,
      "notes": "Mission 2 slot A. Final page text is rendered by code. Artwork is a marked NON-PRODUCTION placeholder in Phase B.",
      "facing": "recto",
      "parity": "odd"
    },
    {
      "page": 10,
      "section": "missions",
      "type": "search_find",
      "title": "Find the Sky Signs",
      "mission_id": "mission_02",
      "mission_sequence": 2,
      "mission_slot": "B",
      "canon_id": "genesis_1_14",
      "activity_mechanic": "search_find_sky_signs",
      "art_roles": [
        "search_background",
        "search_target"
      ],
      "artwork_status": "placeholder_only",
      "answer_key_page": 38,
      "answers_activity_pages": [],
      "answer_sources": [],
      "source_mission_page": 2,
      "child_instruction_required": true,
      "notes": "Mission 2 slot B. Final page text is rendered by code. Artwork is a marked NON-PRODUCTION placeholder in Phase B.",
      "facing": "verso",
      "parity": "even"
    },
    {
      "page": 11,
      "section": "missions",
      "type": "maze",
      "title": "Follow the Day to Night",
      "mission_id": "mission_02",
      "mission_sequence": 2,
      "mission_slot": "C",
      "canon_id": "genesis_1_14",
      "activity_mechanic": "maze_sunrise_to_harvest_moon",
      "art_roles": [
        "maze_scene"
      ],
      "artwork_status": "placeholder_only",
      "answer_key_page": 38,
      "answers_activity_pages": [],
      "answer_sources": [],
      "source_mission_page": 3,
      "child_instruction_required": true,
      "notes": "Mission 2 slot C. Final page text is rendered by code. Artwork is a marked NON-PRODUCTION placeholder in Phase B.",
      "facing": "recto",
      "parity": "odd"
    },
    {
      "page": 12,
      "section": "missions",
      "type": "faith_interaction",
      "title": "Thank God for the Seasons",
      "mission_id": "mission_02",